{
  "version": 1,
  "readyLabel": "ready-for-agent",
  "branchPrefix": "agent/issue-",
  "ciTimeoutMinutes": 60,
  "primaryTimeoutMinutes": 60,
  "metadataTimeoutMinutes": 5,
  "maxPrimaryFixAttempts": 3,
  "localChecks": [
    {
      "name": "test",
      "command": "your-test-command",
      "arguments": []
    }
  ],
  "requiredChecks": ["test"]
}
